[
  {
    "id": "ar-1",
    "business_name": "Midtown Billiards",
    "slug": "midtown-billiards-little-rock",
    "street_address": "1316 Main St",
    "city": "Little Rock",
    "state": "Arkansas",
    "zip": "72202",
    "latitude": 34.7335,
    "longitude": -92.2709,
    "phone": "(501) 372-9990",
    "website": "Unknown",
    "owner_operator": "Unknown",
    "hours": {
      "Mon-Sun": "3:00 PM – 5:00 AM"
    },
    "table_count": 5,
    "table_types": {
      "9-foot": 0,
      "7-foot": 5,
      "8-foot": 0,
      "snooker": 0,
      "carom": 0,
      "bar_tables": 0
    },
    "cloth_type": "Standard",
    "league_types": [],
    "tournament_frequency": "Occasional",
    "weekly_tournament_schedule": "",
    "verified_status": "verified",
    "verification_score": 90,
    "last_verified": "2026-04-28",
    "verification_sources": [
      "google_maps",
      "player_verified"
    ],
    "review_required": false,
    "photo_gallery": [
      "/images/feature-room.jpg"
    ],
    "primary_hero_image": "/images/feature-room.jpg",
    "parking_info": "Street parking",
    "alcohol_food_availability": "Full Bar & Famous Burgers",
    "handicap_accessible": false,
    "room_description": "A long-standing, iconic dive bar known for its late-night atmosphere (open until 5 a.m. daily), legendary burgers, and pool tables. A staple in the SoMa district.",
    "membership_info": "Open to public",
    "local_reputation_notes": "Legendary late-night spot in Little Rock.",
    "source_attribution": [
      "Manual Intel"
    ]
  },
  {
    "id": "ar-2",
    "business_name": "Old School Billiards",
    "slug": "old-school-billiards-fayetteville",
    "street_address": "45 W Colt Square Dr",
    "city": "Fayetteville",
    "state": "Arkansas",
    "zip": "72703",
    "latitude": 36.0921812,
    "longitude": -94.1580378,
    "phone": "(479) 442-1706",
    "website": "https://www.facebook.com/oldschoolnwa/",
    "owner_operator": "Unknown",
    "hours": {
      "Mon-Sun": "12:00 PM – 1:00 AM"
    },
    "table_count": 14,
    "table_types": {
      "9-foot": 6,
      "7-foot": 8,
      "8-foot": 0,
      "snooker": 0,
      "carom": 0,
      "bar_tables": 0
    },
    "cloth_type": "Simonis",
    "league_types": [
      "APA",
      "BCA"
    ],
    "tournament_frequency": "Weekly",
    "weekly_tournament_schedule": "Fridays",
    "verified_status": "verified",
    "verification_score": 100,
    "last_verified": "2026-04-28",
    "verification_sources": [
      "google_maps",
      "facebook_active"
    ],
    "review_required": false,
    "photo_gallery": [
      "/images/hero-table.jpg"
    ],
    "primary_hero_image": "/images/hero-table.jpg",
    "parking_info": "Free lot parking",
    "alcohol_food_availability": "Full Bar & Kitchen",
    "handicap_accessible": true,
    "room_description": "Frequently praised for being a spacious, well-maintained, and family-friendly pool hall. Non-smoking with a variety of bar food.",
    "membership_info": "Open to public",
    "local_reputation_notes": "Best tables in Northwest Arkansas.",
    "source_attribution": [
      "Manual Intel"
    ]
  },
  {
    "id": "ar-3",
    "business_name": "Tables & Ale",
    "slug": "tables-ale-fayetteville",
    "street_address": "102 N Block Ave",
    "city": "Fayetteville",
    "state": "Arkansas",
    "zip": "72701",
    "latitude": 36.0637853,
    "longitude": -94.1602909,
    "phone": "(479) 521-3033",
    "website": "Unknown",
    "owner_operator": "Unknown",
    "hours": {
      "Mon-Sun": "4:00 PM – 2:00 AM"
    },
    "table_count": 8,
    "table_types": {
      "9-foot": 0,
      "7-foot": 8,
      "8-foot": 0,
      "snooker": 0,
      "carom": 0,
      "bar_tables": 0
    },
    "cloth_type": "Standard",
    "league_types": [
      "APA"
    ],
    "tournament_frequency": "Occasional",
    "weekly_tournament_schedule": "",
    "verified_status": "partial_verified",
    "verification_score": 100,
    "last_verified": "2026-04-28",
    "verification_sources": [
      "google_maps",
      "osm_data"
    ],
    "review_required": false,
    "photo_gallery": [
      "/images/feature-player.jpg"
    ],
    "primary_hero_image": "/images/feature-player.jpg",
    "parking_info": "Street parking",
    "alcohol_food_availability": "Full Bar",
    "handicap_accessible": true,
    "room_description": "Popular downtown Fayetteville bar with multiple pool tables.",
    "membership_info": "Open to public",
    "local_reputation_notes": "Good college town bar box action.",
    "source_attribution": [
      "Manual Intel",
      "OpenStreetMap"
    ]
  },
  {
    "id": "ar-4",
    "business_name": "Beezer's Fine Billiards",
    "slug": "beezers-fine-billiards-russellville",
    "street_address": "224 Shamrock Blvd",
    "city": "Russellville",
    "state": "Arkansas",
    "zip": "72801",
    "latitude": 35.2790805,
    "longitude": -93.090625,
    "phone": "Unknown",
    "website": "Unknown",
    "owner_operator": "Unknown",
    "hours": {
      "Mon-Sun": "12:00 PM – 12:00 AM"
    },
    "table_count": 6,
    "table_types": {
      "9-foot": 2,
      "7-foot": 4,
      "8-foot": 0,
      "snooker": 0,
      "carom": 0,
      "bar_tables": 0
    },
    "cloth_type": "Standard",
    "league_types": [],
    "tournament_frequency": "Unknown",
    "weekly_tournament_schedule": "",
    "verified_status": "partial_verified",
    "verification_score": 75,
    "last_verified": "2026-04-28",
    "verification_sources": [
      "osm_data"
    ],
    "review_required": false,
    "photo_gallery": [
      "/images/hero-table.jpg"
    ],
    "primary_hero_image": "/images/hero-table.jpg",
    "parking_info": "Lot parking",
    "alcohol_food_availability": "Unknown",
    "handicap_accessible": true,
    "room_description": "Local pool hall in Russellville.",
    "membership_info": "Open to public",
    "local_reputation_notes": "",
    "source_attribution": [
      "OpenStreetMap"
    ]
  }
]