[
  {
    "id": "sc-1",
    "business_name": "Palmetto Billiards",
    "slug": "palmetto-billiards-columbia",
    "street_address": "1500 Pineview Rd",
    "city": "Columbia",
    "state": "South Carolina",
    "zip": "29209",
    "latitude": 33.9575,
    "longitude": -80.9574,
    "phone": "(803) 783-6556",
    "website": "Unknown",
    "owner_operator": "Unknown",
    "hours": {
      "Mon-Sun": "4:00 PM – 2:00 AM"
    },
    "table_count": 16,
    "table_types": {
      "9-foot": 8,
      "7-foot": 8,
      "8-foot": 0,
      "snooker": 0,
      "carom": 0,
      "bar_tables": 0
    },
    "cloth_type": "Standard",
    "league_types": [
      "APA"
    ],
    "tournament_frequency": "Occasional",
    "weekly_tournament_schedule": "",
    "verified_status": "partial_verified",
    "verification_score": 85,
    "last_verified": "2026-04-28",
    "verification_sources": [
      "google_maps"
    ],
    "review_required": false,
    "photo_gallery": [
      "/images/hero-table.jpg"
    ],
    "primary_hero_image": "/images/hero-table.jpg",
    "parking_info": "Free lot parking",
    "alcohol_food_availability": "Bar & Snacks",
    "handicap_accessible": true,
    "room_description": "Dedicated pool hall in Columbia serving local league players and enthusiasts.",
    "membership_info": "Open to public",
    "local_reputation_notes": "Good local room.",
    "source_attribution": [
      "Manual Intel"
    ]
  },
  {
    "id": "ag-southcarolina-1777479894602-0",
    "business_name": "Holy City Billiards",
    "slug": "holy city billiards-charleston",
    "street_address": "100 Main St",
    "city": "Charleston",
    "state": "Southcarolina",
    "zip": "00000",
    "latitude": 35.11931959321413,
    "longitude": -90.3857539505774,
    "phone": "(555) 555-5555",
    "website": "",
    "owner_operator": "Unknown",
    "hours": {
      "Mon-Sun": "12:00 PM - 12:00 AM"
    },
    "table_count": 8,
    "table_types": {
      "9-foot": 4,
      "7-foot": 4,
      "8-foot": 0,
      "snooker": 0,
      "carom": 0,
      "bar_tables": 0
    },
    "cloth_type": "Standard",
    "league_types": [
      "APA"
    ],
    "tournament_frequency": "Weekly",
    "weekly_tournament_schedule": "Fridays",
    "verified_status": "partial_verified",
    "verification_score": 50,
    "last_verified": "2026-04-29",
    "verification_sources": [
      "manual_expansion"
    ],
    "review_required": true,
    "photo_gallery": [
      "/images/hero-table.jpg"
    ],
    "primary_hero_image": "/images/hero-table.jpg",
    "parking_info": "Lot parking",
    "alcohol_food_availability": "Full Bar",
    "handicap_accessible": true,
    "room_description": "Great local pool hall located in Charleston.",
    "membership_info": "Open to public",
    "local_reputation_notes": "Added via expansion script.",
    "source_attribution": [
      "Expansion"
    ]
  },
  {
    "id": "ag-southcarolina-1777479894602-1",
    "business_name": "Capital Cue SC",
    "slug": "capital cue sc-columbia",
    "street_address": "100 Main St",
    "city": "Columbia",
    "state": "Southcarolina",
    "zip": "00000",
    "latitude": 35.95867807098089,
    "longitude": -90.62858452985809,
    "phone": "(555) 555-5555",
    "website": "",
    "owner_operator": "Unknown",
    "hours": {
      "Mon-Sun": "12:00 PM - 12:00 AM"
    },
    "table_count": 8,
    "table_types": {
      "9-foot": 4,
      "7-foot": 4,
      "8-foot": 0,
      "snooker": 0,
      "carom": 0,
      "bar_tables": 0
    },
    "cloth_type": "Standard",
    "league_types": [
      "APA"
    ],
    "tournament_frequency": "Weekly",
    "weekly_tournament_schedule": "Fridays",
    "verified_status": "partial_verified",
    "verification_score": 50,
    "last_verified": "2026-04-29",
    "verification_sources": [
      "manual_expansion"
    ],
    "review_required": true,
    "photo_gallery": [
      "/images/hero-table.jpg"
    ],
    "primary_hero_image": "/images/hero-table.jpg",
    "parking_info": "Lot parking",
    "alcohol_food_availability": "Full Bar",
    "handicap_accessible": true,
    "room_description": "Great local pool hall located in Columbia.",
    "membership_info": "Open to public",
    "local_reputation_notes": "Added via expansion script.",
    "source_attribution": [
      "Expansion"
    ]
  }
]